[
  {
    "id": "DT_ITEM_BSM_SMITHS_TOOLS",
    "name": "Smith's Tools",
    "description": "A portable set of hammers, tongs, punches and a small file supports ordinary forge work.\n\nTool proficiency is used through the native system check. A furnace, anvil, fuel and raw metal are not included.",
    "saleUnit": "One smith's tools",
    "price": {
      "value": 20,
      "denomination": "gp"
    },
    "weight": {
      "value": 6.4,
      "units": "lb",
      "notes": "Adjusted carried weight for one complete item; 80% of the 2014 baseline."
    },
    "icon": "icons/skills/trades/smithing-tongs-metal-red.webp",
    "category": "tools",
    "tags": [
      "mundane",
      "smith-made",
      "tools"
    ],
    "shops": [
      "blacksmith"
    ],
    "availability": "variable",
    "source": {
      "title": "Devil's Table: Trade & Merchants",
      "reference": "SRD 5.1 (2014), Equipment; native field mapping checked against D&D5e release-5.3.3. Original description and adjusted weight. See docs/BLACKSMITH_GUIDE.md.",
      "license": "SRD 5.1 mechanics: CC-BY-4.0. Original project descriptions: distribution license pending."
    },
    "mechanics": {
      "type": "tool",
      "native": {
        "ability": "str",
        "bonus": "",
        "type": {
          "value": "art",
          "baseItem": "smith"
        },
        "properties": [],
        "activities": {
          "dnd5eactivity000": {
            "_id": "dnd5eactivity000",
            "type": "check",
            "activation": {
              "type": "",
              "condition": "",
              "override": false
            },
            "consumption": {
              "targets": [],
              "scaling": {
                "allowed": false,
                "max": ""
              },
              "spellSlot": true
            },
            "description": {
              "chatFlavor": ""
            },
            "duration": {
              "concentration": false,
              "value": "",
              "units": "",
              "special": "",
              "override": false
            },
            "effects": [],
            "range": {
              "units": "self",
              "special": "",
              "override": false
            },
            "target": {
              "template": {
                "count": "",
                "contiguous": false,
                "type": "",
                "size": "",
                "width": "",
                "height": "",
                "units": ""
              },
              "affects": {
                "count": "",
                "type": "",
                "choice": false,
                "special": ""
              },
              "prompt": true,
              "override": false
            },
            "check": {
              "ability": "str",
              "dc": {}
            },
            "uses": {
              "spent": 0,
              "recovery": []
            },
            "sort": 0
          }
        }
      }
    }
  },
  {
    "id": "DT_ITEM_BSM_LOCK",
    "name": "Lock",
    "description": "A small iron padlock is supplied with its matching key. It secures a suitable hasp or chain; those fittings are sold separately.\n\nUnder the 2014 equipment rules, a creature proficient with thieves’ tools can pick this ordinary lock with a successful DC 15 Dexterity check. The GM resolves the check; purchasing the lock does not configure scene doors.",
    "saleUnit": "One padlock and matching key",
    "price": {
      "value": 10,
      "denomination": "gp"
    },
    "weight": {
      "value": 0.5,
      "units": "lb",
      "notes": "Adjusted carried weight for the complete iron fitting and key."
    },
    "icon": "icons/sundries/misc/lock-bronze-reinforced.webp",
    "category": "tools",
    "tags": [
      "mundane",
      "iron",
      "security"
    ],
    "shops": [
      "blacksmith"
    ],
    "availability": "variable",
    "source": {
      "title": "Devil's Table: Trade & Merchants",
      "reference": "SRD 5.1 (2014) adventuring gear, lock/manacles; original description and adjusted weight.",
      "license": "SRD 5.1 mechanics: CC-BY-4.0; original text distribution license pending."
    },
    "mechanics": {
      "type": "loot",
      "subtype": "gear"
    }
  },
  {
    "id": "DT_ITEM_BSM_MANACLES",
    "name": "Manacles",
    "description": "A pair of hinged iron restraints is joined by a short chain and supplied with one key. They fit an ordinary Small or Medium creature.\n\nThe 2014 baseline uses DC 20 Dexterity to escape or DC 20 Strength to break them. A proficient user of thieves’ tools can pick the lock with a DC 15 Dexterity check. Each set has 15 hit points. The GM handles restraint and damage; no condition is applied automatically.",
    "saleUnit": "One set of manacles and matching key",
    "price": {
      "value": 2,
      "denomination": "gp"
    },
    "weight": {
      "value": 4,
      "units": "lb",
      "notes": "Adjusted carried weight for the complete iron fitting and key."
    },
    "icon": "icons/sundries/survival/cuffs-shackles-steel.webp",
    "category": "tools",
    "tags": [
      "mundane",
      "iron",
      "security"
    ],
    "shops": [
      "blacksmith"
    ],
    "availability": "variable",
    "source": {
      "title": "Devil's Table: Trade & Merchants",
      "reference": "SRD 5.1 (2014) adventuring gear, lock/manacles; original description and adjusted weight.",
      "license": "SRD 5.1 mechanics: CC-BY-4.0; original text distribution license pending."
    },
    "mechanics": {
      "type": "loot",
      "subtype": "gear"
    }
  }
]
